{
  "schemaVersion": 2,
  "contentRevision": "ws-content-r2.1",
  "domain": "days",
  "records": [
    {
      "id": "DAY-01",
      "sourceDocumentId": "BALANCE-D10-001",
      "enabled": true,
      "day": 1,
      "progressExp": 80,
      "activityExp": 30,
      "totalExp": 110,
      "cumulativeExp": 110,
      "expectedEndLevel": 2,
      "endLevelText": "Lv2, 10/130",
      "threatBudget3": 8,
      "resourceBudgetAuthority": [
        "57/20/37",
        "22/8/14",
        "8/3/5",
        "0/0/0",
        "0/0/0"
      ],
      "resourceBudgetTotals": [
        57,
        22,
        8,
        0,
        0
      ],
      "eventIds": [
        "ACT-D1-WORKTRACE"
      ],
      "bossId": "",
      "milestoneText": "첫 투자",
      "finalAvailable": false,
      "completionAllowed": false,
      "stateMachine": [
        "PREPARING",
        "ACTIVE",
        "PRESSURE",
        "RESOLVING",
        "COMPLETED"
      ]
    },
    {
      "id": "DAY-02",
      "sourceDocumentId": "BALANCE-D10-001",
      "enabled": true,
      "day": 2,
      "progressExp": 80,
      "activityExp": 30,
      "totalExp": 110,
      "cumulativeExp": 220,
      "expectedEndLevel": 2,
      "endLevelText": "Lv2, 120/130",
      "threatBudget3": 10,
      "resourceBudgetAuthority": [
        "50/20/67",
        "23/12/25",
        "12/10/7",
        "0/0/0",
        "0/0/0"
      ],
      "resourceBudgetTotals": [
        50,
        23,
        12,
        0,
        0
      ],
      "eventIds": [
        "ACT-D2-ORE",
        "ACT-D2-HERD"
      ],
      "bossId": "",
      "milestoneText": "Lv3 직전",
      "finalAvailable": false,
      "completionAllowed": false,
      "stateMachine": [
        "PREPARING",
        "ACTIVE",
        "PRESSURE",
        "RESOLVING",
        "COMPLETED"
      ]
    },
    {
      "id": "DAY-03",
      "sourceDocumentId": "BALANCE-D10-001",
      "enabled": true,
      "day": 3,
      "progressExp": 140,
      "activityExp": 60,
      "totalExp": 200,
      "cumulativeExp": 420,
      "expectedEndLevel": 4,
      "endLevelText": "Lv4, 20/220",
      "threatBudget3": 13,
      "resourceBudgetAuthority": [
        "44/18/93",
        "21/15/31",
        "13/14/6",
        "0/0/0",
        "0/0/0"
      ],
      "resourceBudgetTotals": [
        44,
        21,
        13,
        0,
        0
      ],
      "eventIds": [
        "ACT-D3-ORE",
        "ACT-D3-HERD"
      ],
      "bossId": "",
      "milestoneText": "Lv3 실버 개인 증강",
      "finalAvailable": false,
      "completionAllowed": false,
      "stateMachine": [
        "PREPARING",
        "ACTIVE",
        "PRESSURE",
        "RESOLVING",
        "COMPLETED"
      ]
    },
    {
      "id": "DAY-04",
      "sourceDocumentId": "BALANCE-D10-001",
      "enabled": true,
      "day": 4,
      "progressExp": 150,
      "activityExp": 60,
      "totalExp": 210,
      "cumulativeExp": 630,
      "expectedEndLevel": 5,
      "endLevelText": "Lv5, 10/280",
      "threatBudget3": 14,
      "resourceBudgetAuthority": [
        "41/15/119",
        "20/12/39",
        "18/15/9",
        "4/4/0",
        "0/0/0"
      ],
      "resourceBudgetTotals": [
        41,
        20,
        18,
        4,
        0
      ],
      "eventIds": [
        "ACT-D4-CRYSTAL",
        "ACT-D4-BLOOM"
      ],
      "bossId": "",
      "milestoneText": "무기 역할 분화",
      "finalAvailable": false,
      "completionAllowed": false,
      "stateMachine": [
        "PREPARING",
        "ACTIVE",
        "PRESSURE",
        "RESOLVING",
        "COMPLETED"
      ]
    },
    {
      "id": "DAY-05",
      "sourceDocumentId": "BALANCE-D10-001",
      "enabled": true,
      "day": 5,
      "progressExp": 180,
      "activityExp": 80,
      "totalExp": 260,
      "cumulativeExp": 890,
      "expectedEndLevel": 5,
      "endLevelText": "Lv5, 270/280",
      "threatBudget3": 17,
      "resourceBudgetAuthority": [
        "38/14/143",
        "20/12/47",
        "24/16/17",
        "5/2/3",
        "1/0/1"
      ],
      "resourceBudgetTotals": [
        38,
        20,
        24,
        5,
        1
      ],
      "eventIds": [
        "ACT-D5-SIGNAL",
        "ACT-D5-RIFT",
        "ACT-D5-BLOOM"
      ],
      "bossId": "",
      "milestoneText": "Lv6 직전",
      "finalAvailable": false,
      "completionAllowed": false,
      "stateMachine": [
        "PREPARING",
        "ACTIVE",
        "PRESSURE",
        "RESOLVING",
        "COMPLETED"
      ]
    },
    {
      "id": "DAY-06",
      "sourceDocumentId": "BALANCE-D10-001",
      "enabled": true,
      "day": 6,
      "progressExp": 230,
      "activityExp": 110,
      "totalExp": 340,
      "cumulativeExp": 1230,
      "expectedEndLevel": 6,
      "endLevelText": "Lv6, 330/350",
      "threatBudget3": 18,
      "resourceBudgetAuthority": [
        "35/12/166",
        "19/12/54",
        "27/14/30",
        "8/3/8",
        "3/2/2"
      ],
      "resourceBudgetTotals": [
        35,
        19,
        27,
        8,
        3
      ],
      "eventIds": [
        "ACT-D6-WRECK",
        "ACT-D6-CRYSTAL",
        "ACT-D6-RATION",
        "ACT-D6-RIFT"
      ],
      "bossId": "",
      "milestoneText": "Lv6 골드 개인 증강",
      "finalAvailable": false,
      "completionAllowed": false,
      "stateMachine": [
        "PREPARING",
        "ACTIVE",
        "PRESSURE",
        "RESOLVING",
        "COMPLETED"
      ]
    },
    {
      "id": "DAY-07",
      "sourceDocumentId": "BALANCE-D10-001",
      "enabled": true,
      "day": 7,
      "progressExp": 215,
      "activityExp": 85,
      "totalExp": 300,
      "cumulativeExp": 1530,
      "expectedEndLevel": 7,
      "endLevelText": "Lv7, 280/430",
      "threatBudget3": 21,
      "resourceBudgetAuthority": [
        "34/10/190",
        "19/11/62",
        "28/12/46",
        "9/2/15",
        "4/2/4"
      ],
      "resourceBudgetTotals": [
        34,
        19,
        28,
        9,
        4
      ],
      "eventIds": [
        "ACT-D7-SIGNAL",
        "ACT-D7-RIFT",
        "ACT-D7-ORE"
      ],
      "bossId": "",
      "milestoneText": "AP·방어 투자 체감",
      "finalAvailable": false,
      "completionAllowed": false,
      "stateMachine": [
        "PREPARING",
        "ACTIVE",
        "PRESSURE",
        "RESOLVING",
        "COMPLETED"
      ]
    },
    {
      "id": "DAY-08",
      "sourceDocumentId": "BALANCE-D10-001",
      "enabled": true,
      "day": 8,
      "progressExp": 240,
      "activityExp": 110,
      "totalExp": 350,
      "cumulativeExp": 1880,
      "expectedEndLevel": 8,
      "endLevelText": "Lv8, 200/520",
      "threatBudget3": 23,
      "resourceBudgetAuthority": [
        "32/8/214",
        "19/10/71",
        "28/12/62",
        "10/2/23",
        "6/2/8"
      ],
      "resourceBudgetTotals": [
        32,
        19,
        28,
        10,
        6
      ],
      "eventIds": [
        "ACT-D8-RESONANCE",
        "ACT-D8-ELITE_TRACE"
      ],
      "bossId": "",
      "milestoneText": "첫 정예·희귀 장비",
      "finalAvailable": false,
      "completionAllowed": false,
      "stateMachine": [
        "PREPARING",
        "ACTIVE",
        "PRESSURE",
        "RESOLVING",
        "COMPLETED"
      ]
    },
    {
      "id": "DAY-09",
      "sourceDocumentId": "BALANCE-D10-001",
      "enabled": true,
      "day": 9,
      "progressExp": 275,
      "activityExp": 145,
      "totalExp": 420,
      "cumulativeExp": 2300,
      "expectedEndLevel": 9,
      "endLevelText": "Lv9, 100/620",
      "threatBudget3": 26,
      "resourceBudgetAuthority": [
        "31/7/238",
        "18/10/79",
        "28/10/80",
        "12/3/32",
        "7/3/12"
      ],
      "resourceBudgetTotals": [
        31,
        18,
        28,
        12,
        7
      ],
      "eventIds": [
        "ACT-D9-SIGNAL",
        "ACT-D9-RIFT",
        "ACT-D9-ELITE_TRACE"
      ],
      "bossId": "",
      "milestoneText": "보스 준비 완성",
      "finalAvailable": false,
      "completionAllowed": false,
      "stateMachine": [
        "PREPARING",
        "ACTIVE",
        "PRESSURE",
        "RESOLVING",
        "COMPLETED"
      ]
    },
    {
      "id": "DAY-10",
      "sourceDocumentId": "BALANCE-D10-001",
      "enabled": true,
      "day": 10,
      "progressExp": 384,
      "activityExp": 136,
      "totalExp": 520,
      "cumulativeExp": 2820,
      "expectedEndLevel": 10,
      "endLevelText": "Lv10, 0/730",
      "threatBudget3": -1,
      "resourceBudgetAuthority": [
        "21/7/252",
        "18/13/84",
        "20/15/85",
        "9/3/38",
        "4/3/13"
      ],
      "resourceBudgetTotals": [
        21,
        18,
        20,
        9,
        4
      ],
      "eventIds": [
        "ACT-D10-SIGNAL",
        "ACT-D10-CRYSTAL",
        "ACT-D10-SAFETY"
      ],
      "bossId": "BOSS-D10",
      "milestoneText": "Lv10 프리즘, 처치 후 파티 증강",
      "finalAvailable": false,
      "completionAllowed": false,
      "stateMachine": [
        "PREPARING",
        "ACTIVE",
        "PRESSURE",
        "RESOLVING",
        "COMPLETED"
      ]
    },
    {
      "id": "DAY-11",
      "sourceDocumentId": "BALANCE-D20-001",
      "enabled": true,
      "day": 11,
      "progressExp": 595,
      "activityExp": 255,
      "totalExp": 850,
      "cumulativeExp": 3670,
      "expectedEndLevel": 11,
      "endLevelText": "Lv11, 120/850",
      "threatBudget3": 21,
      "resourceBudgetAuthority": [
        "32/18/14",
        "22/12/10",
        "25/15/10",
        "10/5/5",
        "10/4/6"
      ],
      "resourceBudgetTotals": [
        32,
        22,
        25,
        10,
        10
      ],
      "eventIds": [
        "EV20-11-TRIAGE"
      ],
      "bossId": "",
      "milestoneText": "상태 저항 투자 시작",
      "finalAvailable": false,
      "completionAllowed": false,
      "stateMachine": [
        "PREPARING",
        "ACTIVE",
        "PRESSURE",
        "RESOLVING",
        "COMPLETED"
      ]
    },
    {
      "id": "DAY-12",
      "sourceDocumentId": "BALANCE-D20-001",